{
  "schemaVersion": "clervo.private-workflow-catalog.v1",
  "lifecycle": "private_qualified",
  "publicAvailable": false,
  "workflows": [
    { "workflowId": "workflow.web_research_execute", "version": "2026-08-02.1", "pillars": ["search", "ai", "sandbox"], "products": ["search.web", "ai.chat", "sandbox.run"], "replaySafe": true, "maximumSupplierCostMicrousd": 205000, "publicAvailable": false },
    { "workflowId": "workflow.prediction_investigate", "version": "2026-08-02.1", "pillars": ["prediction", "ai", "sandbox"], "products": ["prediction.compare", "ai.chat", "sandbox.run"], "replaySafe": true, "maximumSupplierCostMicrousd": 205000, "publicAvailable": false },
    { "workflowId": "workflow.wallet_explain_verify", "version": "2026-08-02.1", "pillars": ["crypto", "ai", "rpc"], "products": ["crypto.wallet.report", "ai.chat", "rpc.call"], "replaySafe": true, "maximumSupplierCostMicrousd": 110000, "publicAvailable": false }
  ],
  "coreQualifications": [
    { "pillar": "search", "privateCoreQualified": true, "publicLifecycle": "preview", "consolidatedTest": "test:stage4:campaign" },
    { "pillar": "ai", "privateCoreQualified": true, "publicLifecycle": "unavailable", "consolidatedTest": "test:stage6:local" },
    { "pillar": "sandbox", "privateCoreQualified": true, "publicLifecycle": "unavailable", "consolidatedTest": "test:stage7:local" },
    { "pillar": "rpc", "privateCoreQualified": true, "publicLifecycle": "unavailable", "consolidatedTest": "test:stage8:local" },
    { "pillar": "prediction", "privateCoreQualified": true, "publicLifecycle": "unavailable", "consolidatedTest": "test:stage9:local" },
    { "pillar": "crypto", "privateCoreQualified": true, "publicLifecycle": "unavailable", "consolidatedTest": "test:stage10:local" }
  ],
  "stability": {
    "requiredDrills": 8,
    "passedDrills": 8,
    "failedDrills": 0,
    "realPaymentUsed": false,
    "productionMutationUsed": false
  }
}
